{
  "format_version": 2,
  "model_id": "or-map",
  "profile": "independent-updates",
  "replicas": [
    "a",
    "b"
  ],
  "bootstrap": {
    "a": {},
    "b": {}
  },
  "seed": 19,
  "network": {
    "minLatency": 1,
    "maxLatency": 3,
    "dropRate": 0.5,
    "duplicateRate": 0.5
  },
  "steps": [
    {
      "at": 0,
      "action": "command",
      "replica": "a",
      "command": {
        "action": "put",
        "key": "mode",
        "value": "safe"
      }
    },
    {
      "at": 10,
      "action": "heal"
    }
  ],
  "checks": [
    {
      "id": "convergence",
      "parameters": null
    }
  ]
}
